{"candidate_bindings_base64":["eyJhZGFwdGVyX2RpZ2VzdCI6InNoYTI1NjoyMGQwZjc5MmEwMWM3ODA3NmZhZDZhZjIyZDY3NDQ3YmRkMjIxZWY3YmI1ZGI4ZTNjMzQ5ZGJkYTY1YjA1YmM3IiwibWF0ZXJpYWxpemF0aW9uX3BvbGljeV9kaWdlc3QiOiJzaGEyNTY6ZGFlYjE2NjViMTI0OWY0ODJmOWIxYzU2OTZhNDY2MTg0MzA3YWY2NGE5Njc1NGY4YTRjMDMxMDM1YTFjNjAzYiIsInByb2plY3Rpb25fZGVmaW5pdGlvbl9kaWdlc3QiOiJzaGEyNTY6OGIyMDc3ZGYyYTA4MTJiZjZhZDcxMzAzMmM3ZjRkNWJjMWUxNzU2NWUzNmRhZWUwY2JhMTViYmMzOGQ1NjQ0YyIsInJ1bm5lcl9kaWdlc3QiOiJzaGEyNTY6ZDIzM2M3NWExODI1NDIxYjdlYzU1YjEzOWE4MjQwZTk0OWEwMGQwNWI1NmU3N2FjMjFhOWJlYTJhNDZiYTQ2OSIsInRyZWVfaWRlbnRpdHlfZGlnZXN0Ijoic2hhMjU2OmQzMzZjY2VmMjg2YzU0NDlmZDFjZDEzZTc4OTVkZjNjYjk3ZjRlYWFiNDBiODAzMmQxZTg3MTk3YTA2ZTg5ZjYiLCJ3b3JsZF9wbGFuX2RpZ2VzdCI6InNoYTI1NjplNmYwNzMwM2FhM2ViNTA1OTc2Mjk5MGY4MDFlMmY3Y2NmZTdhNmFhNzllYjIyZTNlNTVhNGQyNWJkNjA3MDc4In0=","eyJhZGFwdGVyX2RpZ2VzdCI6InNoYTI1NjoyMGQwZjc5MmEwMWM3ODA3NmZhZDZhZjIyZDY3NDQ3YmRkMjIxZWY3YmI1ZGI4ZTNjMzQ5ZGJkYTY1YjA1YmM3IiwibWF0ZXJpYWxpemF0aW9uX3BvbGljeV9kaWdlc3QiOiJzaGEyNTY6ZGFlYjE2NjViMTI0OWY0ODJmOWIxYzU2OTZhNDY2MTg0MzA3YWY2NGE5Njc1NGY4YTRjMDMxMDM1YTFjNjAzYiIsInByb2plY3Rpb25fZGVmaW5pdGlvbl9kaWdlc3QiOiJzaGEyNTY6OGIyMDc3ZGYyYTA4MTJiZjZhZDcxMzAzMmM3ZjRkNWJjMWUxNzU2NWUzNmRhZWUwY2JhMTViYmMzOGQ1NjQ0YyIsInJ1bm5lcl9kaWdlc3QiOiJzaGEyNTY6ZDIzM2M3NWExODI1NDIxYjdlYzU1YjEzOWE4MjQwZTk0OWEwMGQwNWI1NmU3N2FjMjFhOWJlYTJhNDZiYTQ2OSIsInRyZWVfaWRlbnRpdHlfZGlnZXN0Ijoic2hhMjU2OjBjZjg3YjMwNWMyYTdlYmI0ODA3OTliMGFkYTYwMDc5ZjgyZGJhMDJlM2M3ODI4YjI3NWQ3NzFjMzlmNmIzZTYiLCJ3b3JsZF9wbGFuX2RpZ2VzdCI6InNoYTI1NjplNmYwNzMwM2FhM2ViNTA1OTc2Mjk5MGY4MDFlMmY3Y2NmZTdhNmFhNzllYjIyZTNlNTVhNGQyNWJkNjA3MDc4In0=","eyJhZGFwdGVyX2RpZ2VzdCI6InNoYTI1NjoyMGQwZjc5MmEwMWM3ODA3NmZhZDZhZjIyZDY3NDQ3YmRkMjIxZWY3YmI1ZGI4ZTNjMzQ5ZGJkYTY1YjA1YmM3IiwibWF0ZXJpYWxpemF0aW9uX3BvbGljeV9kaWdlc3QiOiJzaGEyNTY6ZGFlYjE2NjViMTI0OWY0ODJmOWIxYzU2OTZhNDY2MTg0MzA3YWY2NGE5Njc1NGY4YTRjMDMxMDM1YTFjNjAzYiIsInByb2plY3Rpb25fZGVmaW5pdGlvbl9kaWdlc3QiOiJzaGEyNTY6OGIyMDc3ZGYyYTA4MTJiZjZhZDcxMzAzMmM3ZjRkNWJjMWUxNzU2NWUzNmRhZWUwY2JhMTViYmMzOGQ1NjQ0YyIsInJ1bm5lcl9kaWdlc3QiOiJzaGEyNTY6ZDIzM2M3NWExODI1NDIxYjdlYzU1YjEzOWE4MjQwZTk0OWEwMGQwNWI1NmU3N2FjMjFhOWJlYTJhNDZiYTQ2OSIsInRyZWVfaWRlbnRpdHlfZGlnZXN0Ijoic2hhMjU2OjcwNjEzM2FhZDQwZTUxNjA2MmU4NWFkZmZhOWFkYjg4ZTkwOTZlYjUxOGFhZTg5NmU4ZTFmNGE4MjcwNzM4NjUiLCJ3b3JsZF9wbGFuX2RpZ2VzdCI6InNoYTI1NjplNmYwNzMwM2FhM2ViNTA1OTc2Mjk5MGY4MDFlMmY3Y2NmZTdhNmFhNzllYjIyZTNlNTVhNGQyNWJkNjA3MDc4In0="],"candidate_execution_keys":["candidate:105ce767edb12785c2418d50c37ecad4de9f0b82786b99cd7ee6b681de30ecce","candidate:27330e5adae8eacff10e03f36ef4f433293eab0170d5e827931e22899b32e332","candidate:bcc06cddaa6c8ff77d75691f51cda980324ba20c968432d33ca0a3fc76d23c6e"],"candidate_reveals":[{"candidate_execution_key":"candidate:105ce767edb12785c2418d50c37ecad4de9f0b82786b99cd7ee6b681de30ecce","display_ref":"config-first","producer_metadata":"outer deterministic CLI precedence fixture"},{"candidate_execution_key":"candidate:27330e5adae8eacff10e03f36ef4f433293eab0170d5e827931e22899b32e332","display_ref":"env-first","producer_metadata":"outer deterministic CLI precedence fixture"},{"candidate_execution_key":"candidate:bcc06cddaa6c8ff77d75691f51cda980324ba20c968432d33ca0a3fc76d23c6e","display_ref":"argv-first","producer_metadata":"outer deterministic CLI precedence fixture"}],"choice_projection_mode":"ADAPTER_BOUND_PORTABLE_FIELDS_V1","comparison_envelope_base64":"eyJhZG1pc3Npb25fY2xhaW0iOiJNRUFTVVJFRF9BU1NFU1NNRU5UX09OTFkiLCJiZWhhdmlvcmFsX2NvbXBhdGliaWxpdHlfZXN0YWJsaXNoZWQiOmZhbHNlLCJlbnZlbG9wZV92ZXJzaW9uIjoidTdjLWNsaS1zdHVkeS92MSIsImtpbmQiOiJDb21wYXJpc29uRW52ZWxvcGUiLCJtZWFzdXJlZF9kaW1lbnNpb25zIjpbeyJjb21wYXJpc29uIjoiRVhBQ1QiLCJuYW1lIjoiQ0xJIGV4ZWN1dGlvbiBhdXRob3JpdHkiLCJzb3VyY2UiOiJQUk9DRVNTX1JFQ0VJUFQifSx7ImNvbXBhcmlzb24iOiJSRUNPUkRFRF9PTkxZIiwibmFtZSI6ImF0dGVtcHQgYXJ0aWZhY3QgZGlnZXN0Iiwic291cmNlIjoiV09STERfSU5TVEFOQ0UifSx7ImNvbXBhcmlzb24iOiJSRUNPUkRFRF9PTkxZIiwibmFtZSI6ImZpeHR1cmUgb3ZlcmxheSByZWNlaXB0Iiwic291cmNlIjoiRklMRVNZU1RFTV9QUk9CRSJ9LHsiY29tcGFyaXNvbiI6IlJFQ09SREVEX09OTFkiLCJuYW1lIjoiZml4dHVyZSByb290Iiwic291cmNlIjoiRklMRVNZU1RFTV9QUk9CRSJ9LHsiY29tcGFyaXNvbiI6IlJFQ09SREVEX09OTFkiLCJuYW1lIjoiaW52b2NhdGlvbiBldmlkZW5jZSByZWNlaXB0Iiwic291cmNlIjoiUFJPQ0VTU19SRUNFSVBUIn0seyJjb21wYXJpc29uIjoiUkVDT1JERURfT05MWSIsIm5hbWUiOiJsb2dpY2FsIGFyZ3YiLCJzb3VyY2UiOiJQUk9DRVNTX1JFQ0VJUFQifSx7ImNvbXBhcmlzb24iOiJSRUNPUkRFRF9PTkxZIiwibmFtZSI6InBoeXNpY2FsIGV4ZWN1dGlvbiBlbnRlcmVkIiwic291cmNlIjoiUFJPQ0VTU19SRUNFSVBUIn0seyJjb21wYXJpc29uIjoiUkVDT1JERURfT05MWSIsIm5hbWUiOiJwcm9jZXNzIGlkIiwic291cmNlIjoiUFJPQ0VTU19SRUNFSVBUIn0seyJjb21wYXJpc29uIjoiUkVDT1JERURfT05MWSIsIm5hbWUiOiJzY2hlZHVsZSBvcmRpbmFsIiwic291cmNlIjoiV09STERfSU5TVEFOQ0UifSx7ImNvbXBhcmlzb24iOiJSRUNPUkRFRF9PTkxZIiwibmFtZSI6InN0ZGVyciBvYnNlcnZlZCBieXRlcyIsInNvdXJjZSI6IlBST0NFU1NfUkVDRUlQVCJ9LHsiY29tcGFyaXNvbiI6IkVYQUNUIiwibmFtZSI6InN0ZGluIGJ5dGUgY291bnQiLCJzb3VyY2UiOiJQUk9DRVNTX1JFQ0VJUFQifSx7ImNvbXBhcmlzb24iOiJFWEFDVCIsIm5hbWUiOiJzdGRpbiBwcmVzZW5jZSIsInNvdXJjZSI6IlBST0NFU1NfUkVDRUlQVCJ9LHsiY29tcGFyaXNvbiI6IlJFQ09SREVEX09OTFkiLCJuYW1lIjoic3Rkb3V0IG9ic2VydmVkIGJ5dGVzIiwic291cmNlIjoiUFJPQ0VTU19SRUNFSVBUIn0seyJjb21wYXJpc29uIjoiRVhBQ1QiLCJuYW1lIjoidG9vbCBleGVjdXRhYmxlIGRpZ2VzdCIsInNvdXJjZSI6IlRPT0xfUkVDRUlQVCJ9LHsiY29tcGFyaXNvbiI6IkVYQUNUIiwibmFtZSI6InRvb2wgbWFqb3IgdmVyc2lvbiIsInNvdXJjZSI6IlRPT0xfUkVDRUlQVCJ9LHsiY29tcGFyaXNvbiI6IlJFQ09SREVEX09OTFkiLCJuYW1lIjoid29ya2luZyBkaXJlY3RvcnkiLCJzb3VyY2UiOiJQUk9DRVNTX1JFQ0VJUFQifSx7ImNvbXBhcmlzb24iOiJFWEFDVCIsIm5hbWUiOiJ3b3JraW5nLWRpcmVjdG9yeSBwb2xpY3kiLCJzb3VyY2UiOiJQUk9DRVNTX1JFQ0VJUFQifSx7ImNvbXBhcmlzb24iOiJSRUNPUkRFRF9PTkxZIiwibmFtZSI6IndvcmxkIGluc3RhbmNlIGRpZ2VzdCIsInNvdXJjZSI6IldPUkxEX0lOU1RBTkNFIn1dLCJwbGFjZWhvbGRlcl9jb250cm9sX2Zsb3dfaXJyZWxldmFuY2VfZXN0YWJsaXNoZWQiOmZhbHNlLCJyZWplY3RlZF9kaW1lbnNpb25zIjpudWxsLCJyZXF1aXJlZF9lcXVhbF9kaW1lbnNpb25zIjpbeyJjb21wYXJhdG9yIjoiRVhBQ1QiLCJuYW1lIjoiQ0xJIGV4ZWN1dGlvbiBhdXRob3JpdHkifSx7ImNvbXBhcmF0b3IiOiJFWEFDVCIsIm5hbWUiOiJzdGRpbiBieXRlIGNvdW50In0seyJjb21wYXJhdG9yIjoiRVhBQ1QiLCJuYW1lIjoic3RkaW4gcHJlc2VuY2UifSx7ImNvbXBhcmF0b3IiOiJFWEFDVCIsIm5hbWUiOiJ0b29sIGV4ZWN1dGFibGUgZGlnZXN0In0seyJjb21wYXJhdG9yIjoiRVhBQ1QiLCJuYW1lIjoidG9vbCBtYWpvciB2ZXJzaW9uIn0seyJjb21wYXJhdG9yIjoiRVhBQ1QiLCJuYW1lIjoid29ya2luZy1kaXJlY3RvcnkgcG9saWN5In1dLCJzY2hlbWFfdmVyc2lvbiI6ImNvdW50ZXJzaGFwZS92MSIsInRvbGVyYXRlZF9kaW1lbnNpb25zIjpbeyJuYW1lIjoiYXR0ZW1wdCBhcnRpZmFjdCBkaWdlc3QiLCJub25jbGFpbSI6IkNPTlRST0xfRkxPV19JUlJFTEVWQU5DRV9OT1RfRVNUQUJMSVNIRUQiLCJ0b2xlcmFuY2UiOiJNQVlfRElGRkVSX0FORF9JU19SRUNPUkRFRCJ9LHsibmFtZSI6ImZpeHR1cmUgb3ZlcmxheSByZWNlaXB0Iiwibm9uY2xhaW0iOiJDT05UUk9MX0ZMT1dfSVJSRUxFVkFOQ0VfTk9UX0VTVEFCTElTSEVEIiwidG9sZXJhbmNlIjoiTUFZX0RJRkZFUl9BTkRfSVNfUkVDT1JERUQifSx7Im5hbWUiOiJmaXh0dXJlIHJvb3QiLCJub25jbGFpbSI6IkNPTlRST0xfRkxPV19JUlJFTEVWQU5DRV9OT1RfRVNUQUJMSVNIRUQiLCJ0b2xlcmFuY2UiOiJNQVlfRElGRkVSX0FORF9JU19SRUNPUkRFRCJ9LHsibmFtZSI6Imludm9jYXRpb24gZXZpZGVuY2UgcmVjZWlwdCIsIm5vbmNsYWltIjoiQ09OVFJPTF9GTE9XX0lSUkVMRVZBTkNFX05PVF9FU1RBQkxJU0hFRCIsInRvbGVyYW5jZSI6Ik1BWV9ESUZGRVJfQU5EX0lTX1JFQ09SREVEIn0seyJuYW1lIjoibG9naWNhbCBhcmd2Iiwibm9uY2xhaW0iOiJDT05UUk9MX0ZMT1dfSVJSRUxFVkFOQ0VfTk9UX0VTVEFCTElTSEVEIiwidG9sZXJhbmNlIjoiTUFZX0RJRkZFUl9BTkRfSVNfUkVDT1JERUQifSx7Im5hbWUiOiJwaHlzaWNhbCBleGVjdXRpb24gZW50ZXJlZCIsIm5vbmNsYWltIjoiQ09OVFJPTF9GTE9XX0lSUkVMRVZBTkNFX05PVF9FU1RBQkxJU0hFRCIsInRvbGVyYW5jZSI6Ik1BWV9ESUZGRVJfQU5EX0lTX1JFQ09SREVEIn0seyJuYW1lIjoicHJvY2VzcyBpZCIsIm5vbmNsYWltIjoiQ09OVFJPTF9GTE9XX0lSUkVMRVZBTkNFX05PVF9FU1RBQkxJU0hFRCIsInRvbGVyYW5jZSI6Ik1BWV9ESUZGRVJfQU5EX0lTX1JFQ09SREVEIn0seyJuYW1lIjoic2NoZWR1bGUgb3JkaW5hbCIsIm5vbmNsYWltIjoiQ09OVFJPTF9GTE9XX0lSUkVMRVZBTkNFX05PVF9FU1RBQkxJU0hFRCIsInRvbGVyYW5jZSI6Ik1BWV9ESUZGRVJfQU5EX0lTX1JFQ09SREVEIn0seyJuYW1lIjoic3RkZXJyIG9ic2VydmVkIGJ5dGVzIiwibm9uY2xhaW0iOiJDT05UUk9MX0ZMT1dfSVJSRUxFVkFOQ0VfTk9UX0VTVEFCTElTSEVEIiwidG9sZXJhbmNlIjoiTUFZX0RJRkZFUl9BTkRfSVNfUkVDT1JERUQifSx7Im5hbWUiOiJzdGRvdXQgb2JzZXJ2ZWQgYnl0ZXMiLCJub25jbGFpbSI6IkNPTlRST0xfRkxPV19JUlJFTEVWQU5DRV9OT1RfRVNUQUJMSVNIRUQiLCJ0b2xlcmFuY2UiOiJNQVlfRElGRkVSX0FORF9JU19SRUNPUkRFRCJ9LHsibmFtZSI6IndvcmtpbmcgZGlyZWN0b3J5Iiwibm9uY2xhaW0iOiJDT05UUk9MX0ZMT1dfSVJSRUxFVkFOQ0VfTk9UX0VTVEFCTElTSEVEIiwidG9sZXJhbmNlIjoiTUFZX0RJRkZFUl9BTkRfSVNfUkVDT1JERUQifSx7Im5hbWUiOiJ3b3JsZCBpbnN0YW5jZSBkaWdlc3QiLCJub25jbGFpbSI6IkNPTlRST0xfRkxPV19JUlJFTEVWQU5DRV9OT1RfRVNUQUJMSVNIRUQiLCJ0b2xlcmFuY2UiOiJNQVlfRElGRkVSX0FORF9JU19SRUNPUkRFRCJ9XSwidW5jb250cm9sbGVkX2RpbWVuc2lvbnMiOlsiaG9zdCBuZXR3b3JrIGF2YWlsYWJpbGl0eSIsImtlcm5lbCBzY2hlZHVsaW5nIGFuZCB3YWxsLWNsb2NrIHRpbWluZyJdfQ==","comparison_envelope_digest":"sha256:31a52c70d4c271d0228445c7de959bd5b4cb9dd2091a97582cb55654380a3be5","confirmed_outcome_map_digest":"sha256:1ae62d522e46b924a0344a7b7bfe504f0e4a7ae8c1858fa2533148eecf1625b8","confirmed_preservation_map_digest":"sha256:a2ec52e39e84f72fd946d9a8a8055afdfa1a6598c416a2a639f7083f080a1ad4","evidence_receipts":[],"evidence_status_when_empty":"UNRECEIPTED","fresh_confirmation_base64":"eyJhdHRlbXB0X2RpZ2VzdHMiOlsic2hhMjU2OjY4MTUwM2EzMzU2MmU0ZWZhOTRhNWQ3YjZhMTdmODkzYzhjMjBjNTdkZDk1NWI2MzIxOGU3YjY3NDBlNDU4MzgiLCJzaGEyNTY6OGUyNWZmMzFhM2M4MmM3NWNmODRjMGI2MGI5OWRmNmE1M2JkMjA5OThhMmI1NDI1MTUwOWE2OGEzNWJiMzFlNyIsInNoYTI1Njo5MGZlM2VlYzQ0ZjEzYjMyZDFiNzU0ZTRkMTUxYjY4N2RjOTk3NzA3ZTU0YjhkNmIxODVhYzg2ZTg1MDEyMDQ3Iiwic2hhMjU2Ojk1ZTg4MjE1OGJiOGM1NWIzYTBiYmFjNDY5NmJhOTIyMzg5NDNiODVmMDBlYzA1MzBiODc0YmU1ZjI1ZGZhMDgiLCJzaGEyNTY6YTlkYzVjMzRmYmE2N2E4NjNmNzFlYmIxMzNjMjllOWM4OWFlOTZiNTY3N2IyYzEzYTY3N2RmYTRjN2Y1ZGY4NSIsInNoYTI1NjplMDMyM2NlN2Q1YjVjNDI5MTZlZmYzZWRhZTBmZjM1MGZjMjNlMzEwNTAyODRjMjEyNTc3MzUyYTdjNGI0MDE0Il0sImJhdGNoX2RpZ2VzdHMiOlsic2hhMjU2OjE1MDEyZWNkYTdhYzg2NzA5NTNkYzdmMDVkNmRlZmQ4ZDM1Yjg3YjMzOTVkNzMyOTA1NjM4ZWZjYzNlMzU4MzEiLCJzaGEyNTY6ODgxYWQ1NTY3YzU2MWI2MzM2OWUwZDYwNjhlMTVlMmE4YTlmYzFkODI2MDEzNjg3NTU3ZjcxZGJlN2RjY2YxMSIsInNoYTI1NjpiYzRiODk1MjJhZTM3ODhhYzQxOTIyOTFiODAxYzBiMjlhZGQ2ZjZiZmY1M2I3MWYyMmY4NGExNjk4MDkwZTliIl0sImNoYWxsZW5nZV9kaWdlc3QiOiJzaGEyNTY6MGM3NTIzZWU5NTQyMjFhZGM3ZmUzMTM4ZmJkODUzMDYwOTM0YmZiZDNlZDQzMDdkYjBiZGVjYzMyZDYxNzBlYyIsImNvbmZpcm1hdGlvbl9waGFzZSI6IkNPTkZJUk1BVElPTiIsImNvbmZpcm1hdGlvbl9zY2hlZHVsZV9kaWdlc3QiOiJzaGEyNTY6NDM4MDdmNmY1M